"","releaseId","ContentType","Title","Date","Url","Keywords","Names","Organizations","Places","AssignedCategories","FavoritesLikes","RetweetsShares","FollowersCount","CommentsCount","WordCount","Source","Party","Gender","IsCurrent","SourceType","EducationLevel","Religion","Race","DateOfBirth","AgeRange","Industry","Military","PriorPublicOffice"
"8271","53589657","Twitter","LIVE on #Periscope: Iowans put you to work at the county fair https://t.co/k4O7ngGKqs","2015-07-15 20:30:39Z","http://twitter.com/RickSantorum/status/621416608339259392","[county;fair;county fair;#periscope]","[]","[]","[]","[]",7,11,235066,NA,13,"Santorum, Rick (R) Presidential Campaign","Republican","Male","True","Candidates > Presidential 2016","Graduate","Roman Catholic","White","1958-05-10","55-64","[Law]","","[Federal;State]"
"8273","53590015","Twitter","|LIVE NOW| Nothing like county fair time in Iowa #meerkat http://t.co/2RWYU5Dplm","2015-07-15 20:34:41Z","http://twitter.com/RickSantorum/status/621417622081523712","[county;nothing;#meerkat]","[]","[]","[Iowa]","[]",7,14,235066,NA,11,"Santorum, Rick (R) Presidential Campaign","Republican","Male","True","Candidates > Presidential 2016","Graduate","Roman Catholic","White","1958-05-10","55-64","[Law]","","[Federal;State]"
"8276","53590289","Twitter","Sen. Santorum speaking with the press at the Clinton County Fair in DeWitt, Iowa. #Rick2016 http://t.co/pmzjCJDH2Z","2015-07-15 20:37:28Z","http://twitter.com/RickSantorum/status/621418322681327617","[press;#Rick2016]","[]","[]","[Iowa]","[]",18,28,235066,NA,16,"Santorum, Rick (R) Presidential Campaign","Republican","Male","True","Candidates > Presidential 2016","Graduate","Roman Catholic","White","1958-05-10","55-64","[Law]","","[Federal;State]"
"8277","53590397","Twitter","LIVE on #Periscope: Nothing like fair time in Iowa https://t.co/EX3Pj6ecqS","2015-07-15 20:38:34Z","http://twitter.com/RickSantorum/status/621418602474926080","[nothing;#periscope]","[]","[]","[Iowa]","[]",13,12,235066,NA,10,"Santorum, Rick (R) Presidential Campaign","Republican","Male","True","Candidates > Presidential 2016","Graduate","Roman Catholic","White","1958-05-10","55-64","[Law]","","[Federal;State]"
"8293","53594995","Twitter","Rick Santorum met with Clinton County GOP Chair Dan Smicker & Iowans at the Clinton County Fair in DeWitt. #Rick2016 http://t.co/xbN7We1TsO","2015-07-15 21:56:23Z","http://twitter.com/RickSantorum/status/621438182320685056","[#Rick2016]","[Rick Santorum]","[]","[]","[]",27,31,235074,NA,21,"Santorum, Rick (R) Presidential Campaign","Republican","Male","True","Candidates > Presidential 2016","Graduate","Roman Catholic","White","1958-05-10","55-64","[Law]","","[Federal;State]"
"8296","53595771","Twitter","Add your name - urge Congress to reject the #IranDeal. #Rick2016 http://t.co/lnAHWOsBr8","2015-07-15 22:15:47Z","http://twitter.com/RickSantorum/status/621443065853669376","[#IranDeal;#Rick2016]","[]","[]","[]","[]",38,52,235072,NA,12,"Santorum, Rick (R) Presidential Campaign","Republican","Male","True","Candidates > Presidential 2016","Graduate","Roman Catholic","White","1958-05-10","55-64","[Law]","","[Federal;State]"
"8304","53597959","Twitter",".@waltrogersforIA welcomed Sen. Santorum to McOtto's Restaurant for a roundtable discussion in Anamosa, IA. http://t.co/ISIFmb5Kjq","2015-07-15 23:30:35Z","http://twitter.com/RickSantorum/status/621461889277632513","[discussion;roundtable discussion]","[]","[]","[Anamosa]","[]",21,31,235077,NA,15,"Santorum, Rick (R) Presidential Campaign","Republican","Male","True","Candidates > Presidential 2016","Graduate","Roman Catholic","White","1958-05-10","55-64","[Law]","","[Federal;State]"
"8306","53598119","Twitter","Meet Senator Santorum in Iowa! #Rick2016 http://t.co/4npLlaqP9h","2015-07-15 23:36:46Z","http://twitter.com/RickSantorum/status/621463445347692544","[#Rick2016]","[]","[]","[Iowa]","[]",22,30,235077,NA,7,"Santorum, Rick (R) Presidential Campaign","Republican","Male","True","Candidates > Presidential 2016","Graduate","Roman Catholic","White","1958-05-10","55-64","[Law]","","[Federal;State]"
"8320","53599517","Twitter","Iowans await Sen. Santorum's Town Hall to begin at Tipton Family Restaurant in Tipton, Iowa. #Rick2016 http://t.co/UGPg4dT7Lm","2015-07-16 00:40:02Z","http://twitter.com/RickSantorum/status/621479367265398784","[iowans;#Rick2016]","[]","[]","[Iowa]","[]",29,33,235077,NA,17,"Santorum, Rick (R) Presidential Campaign","Republican","Male","True","Candidates > Presidential 2016","Graduate","Roman Catholic","White","1958-05-10","55-64","[Law]","","[Federal;State]"
"8325","53599929","Twitter","Rick Santorum speaks to Iowans at the Tipton Family Restaurant in Tipton, IA. #Rick2016 http://t.co/pOYdeou8D1","2015-07-16 01:01:52Z","http://twitter.com/RickSantorum/status/621484861585518592","[iowans;#Rick2016]","[Rick Santorum]","[]","[]","[]",32,26,235077,NA,15,"Santorum, Rick (R) Presidential Campaign","Republican","Male","True","Candidates > Presidential 2016","Graduate","Roman Catholic","White","1958-05-10","55-64","[Law]","","[Federal;State]"
"8331","53600629","Twitter","Great questions and great turnout at Tipton Family Restaurant in Tipton, IA. #Rick2016 http://t.co/pNoDsYukTu","2015-07-16 01:46:39Z","http://twitter.com/RickSantorum/status/621496134519943169","[questions;turnout;great questions;great turnout;#Rick2016]","[]","[]","[]","[]",23,30,235082,NA,14,"Santorum, Rick (R) Presidential Campaign","Republican","Male","True","Candidates > Presidential 2016","Graduate","Roman Catholic","White","1958-05-10","55-64","[Law]","","[Federal;State]"
"8354","53611793","Twitter","Tell Congress NO to the #IranDeal - add your name here: http://t.co/EkVZBrvEDn","2015-07-16 12:40:33Z","http://twitter.com/RickSantorum/status/621660691720740864","[#IranDeal]","[]","[]","[]","[]",38,56,235094,NA,12,"Santorum, Rick (R) Presidential Campaign","Republican","Male","True","Candidates > Presidential 2016","Graduate","Roman Catholic","White","1958-05-10","55-64","[Law]","","[Federal;State]"
"8368","53614517","Twitter","Today in 1969 Apollo 11 departs on it’s historic journey. #WeAreAmericans http://t.co/aOJ8pveBJM","2015-07-16 13:31:33Z","http://twitter.com/RickSantorum/status/621673526098063360","[journey;historic journey;today;#WeAreAmericans]","[]","[]","[]","[]",40,42,235095,NA,12,"Santorum, Rick (R) Presidential Campaign","Republican","Male","True","Candidates > Presidential 2016","Graduate","Roman Catholic","White","1958-05-10","55-64","[Law]","","[Federal;State]"
"8383","53617111","Twitter","LIVE on #Periscope: Breakfast with a few friends  https://t.co/ukEaEwrLUL","2015-07-16 14:18:45Z","http://twitter.com/RickSantorum/status/621685405679616000","[breakfast;friends;#periscope]","[]","[]","[]","[]",10,13,235095,NA,9,"Santorum, Rick (R) Presidential Campaign","Republican","Male","True","Candidates > Presidential 2016","Graduate","Roman Catholic","White","1958-05-10","55-64","[Law]","","[Federal;State]"
"8385","53617249","Twitter","Great questions and standing room only in Wellman! Check out where I'll be in Iowa today here: http://t.co/QkFMRhzpbD http://t.co/yzLnKxWPMd","2015-07-16 14:22:06Z","http://twitter.com/RickSantorum/status/621686245912088576","[questions;room;great questions]","[]","[]","[Iowa;Wellman]","[]",27,34,235096,NA,19,"Santorum, Rick (R) Presidential Campaign","Republican","Male","True","Candidates > Presidential 2016","Graduate","Roman Catholic","White","1958-05-10","55-64","[Law]","","[Federal;State]"
"8386","53617905","Twitter","|LIVE NOW| #SantorumCrowd A few friends joined me for breakfast in Iowa #meerkat http://t.co/6vtAiRLuFl","2015-07-16 14:33:44Z","http://twitter.com/RickSantorum/status/621689176673660928","[breakfast;#meerkat;friends]","[]","[]","[Iowa]","[]",14,16,235095,NA,14,"Santorum, Rick (R) Presidential Campaign","Republican","Male","True","Candidates > Presidential 2016","Graduate","Roman Catholic","White","1958-05-10","55-64","[Law]","","[Federal;State]"
"8435","53627533","Twitter","Great turnout in Wellman. Join me in Keosauqua at 3pm. #Rick2016 http://t.co/QkFMRhzpbD http://t.co/26vIdHqkJn","2015-07-16 16:55:20Z","http://twitter.com/RickSantorum/status/621724811581124608","[turnout;great turnout;#Rick2016]","[]","[]","[Wellman;Keosauqua]","[]",8,20,235100,NA,13,"Santorum, Rick (R) Presidential Campaign","Republican","Male","True","Candidates > Presidential 2016","Graduate","Roman Catholic","White","1958-05-10","55-64","[Law]","","[Federal;State]"
"8442","53628423","Twitter","Mr. O's Cafe with IA Rep.Jared Klein & Trevor Owen, a 19 yr. old restaurant owner. #Rick2016 http://t.co/URFbVwX4Z5","2015-07-16 17:06:44Z","http://twitter.com/RickSantorum/status/621727677582585856","[owner;restaurant;restaurant owner;#Rick2016]","[]","[]","[]","[]",30,28,235097,NA,18,"Santorum, Rick (R) Presidential Campaign","Republican","Male","True","Candidates > Presidential 2016","Graduate","Roman Catholic","White","1958-05-10","55-64","[Law]","","[Federal;State]"
"8443","53629019","Twitter","With Mayor Miller at the Wellman Senior Center. Meet me at 3 in Keosauqua. http://t.co/QkFMRhzpbD http://t.co/3eGLPvyKXZ","2015-07-16 17:17:52Z","http://twitter.com/RickSantorum/status/621730481051160577","[]","[]","[]","[Wellman;Keosauqua]","[Elderly Social Services]",14,22,235096,NA,16,"Santorum, Rick (R) Presidential Campaign","Republican","Male","True","Candidates > Presidential 2016","Graduate","Roman Catholic","White","1958-05-10","55-64","[Law]","","[Federal;State]"
"8449","53630383","Twitter","Tell Rick you agree that the #IranDeal is a big mistake. Add your name here: http://t.co/1LUh0Fpwev","2015-07-16 17:40:51Z","http://twitter.com/RickSantorum/status/621736264841175040","[mistake;#IranDeal]","[]","[]","[]","[]",41,65,235097,NA,16,"Santorum, Rick (R) Presidential Campaign","Republican","Male","True","Candidates > Presidential 2016","Graduate","Roman Catholic","White","1958-05-10","55-64","[Law]","","[Federal;State]"
"8492","53647079","Twitter","LIVE on #Periscope: Making a shake at Misty's Malt Shop https://t.co/KV5KDUs5NQ","2015-07-16 20:06:31Z","http://twitter.com/RickSantorum/status/621772924983250944","[shake;#periscope]","[]","[]","[Malt]","[]",16,19,235102,NA,11,"Santorum, Rick (R) Presidential Campaign","Republican","Male","True","Candidates > Presidential 2016","Graduate","Roman Catholic","White","1958-05-10","55-64","[Law]","","[Federal;State]"
"8545","53661579","Twitter",".@KarenSantorum and I are keeping the victims & those effected by the tragedy in #Chattanooga in our prayers.","2015-07-17 00:12:14Z","http://twitter.com/RickSantorum/status/621834759463903232","[tragedy;prayers;#Chattanooga]","[]","[]","[]","[]",86,59,235115,NA,18,"Santorum, Rick (R) Presidential Campaign","Republican","Male","True","Candidates > Presidential 2016","Graduate","Roman Catholic","White","1958-05-10","55-64","[Law]","","[Federal;State]"
"8620","53680135","Twitter","Ordering a black raspberry malt from Misty's Malt Shop in Keosauqua, Iowa. #Rick2016 http://t.co/Nq3Iq9uQxB","2015-07-17 14:46:48Z","http://twitter.com/RickSantorum/status/622054850407321600","[malt;raspberry;black raspberry;#Rick2016]","[]","[]","[Iowa;Keosauqua;Malt]","[]",27,24,235146,NA,14,"Santorum, Rick (R) Presidential Campaign","Republican","Male","True","Candidates > Presidential 2016","Graduate","Roman Catholic","White","1958-05-10","55-64","[Law]","","[Federal;State]"
"8629","53681875","Twitter","Listening to concerns of Larry Thomas, the owner/pharmacist at LEG Pharmacy in Keosauqua. http://t.co/YLiRWjKAfU","2015-07-17 15:18:56Z","http://twitter.com/RickSantorum/status/622062940166955008","[concerns]","[Larry Thomas]","[]","[Keosauqua]","[Pharmacies]",16,23,235145,NA,14,"Santorum, Rick (R) Presidential Campaign","Republican","Male","True","Candidates > Presidential 2016","Graduate","Roman Catholic","White","1958-05-10","55-64","[Law]","","[Federal;State]"
"8641","53684661","Twitter","Rick Santorum on sanctuary towns. #Rick2016 http://t.co/a9RGI7ZaMA http://t.co/BVuYaffaPu","2015-07-17 16:10:40Z","http://twitter.com/RickSantorum/status/622075958753890304","[towns;sanctuary;#Rick2016]","[Rick Santorum]","[]","[]","[]",59,67,235149,NA,8,"Santorum, Rick (R) Presidential Campaign","Republican","Male","True","Candidates > Presidential 2016","Graduate","Roman Catholic","White","1958-05-10","55-64","[Law]","","[Federal;State]"
"8642","53684953","Twitter","@WashTimes highlighted our campaign on immigration. #Rick2016 http://t.co/YO2CP5ZD1a","2015-07-17 16:15:28Z","http://twitter.com/RickSantorum/status/622077165585199104","[immigration;campaign;campaign on immigration;#Rick2016]","[]","[]","[]","[]",2,11,235150,NA,8,"Santorum, Rick (R) Presidential Campaign","Republican","Male","True","Candidates > Presidential 2016","Graduate","Roman Catholic","White","1958-05-10","55-64","[Law]","","[Federal;State]"
"8659","53689711","Twitter","Sen. Santorum visited with Iowans at The Farmer's Elevator in Wapello this morning. #Rick2016 http://t.co/qXqY6sOYB3","2015-07-17 17:45:36Z","http://twitter.com/RickSantorum/status/622099846451871744","[morning;iowans;#Rick2016]","[]","[]","[Wapello]","[]",14,21,235148,NA,15,"Santorum, Rick (R) Presidential Campaign","Republican","Male","True","Candidates > Presidential 2016","Graduate","Roman Catholic","White","1958-05-10","55-64","[Law]","","[Federal;State]"
"8671","53691185","Twitter","Sen. Santorum greeting supporters at the Ford Dealership in Burlington, IA. #Rick2016 http://t.co/0m7ULEKm7c","2015-07-17 18:13:08Z","http://twitter.com/RickSantorum/status/622106775198781440","[dealership;supporters;#Rick2016]","[Ford Dealership]","[]","[]","[]",23,27,235148,NA,13,"Santorum, Rick (R) Presidential Campaign","Republican","Male","True","Candidates > Presidential 2016","Graduate","Roman Catholic","White","1958-05-10","55-64","[Law]","","[Federal;State]"
"8691","53695639","Twitter","|LIVE NOW| 200,000 square feet of ammunition at Brownells in Iowa  #meerkat http://t.co/aACZFnBP4O","2015-07-17 19:19:52Z","http://twitter.com/RickSantorum/status/622123572413083648","[feet;ammunition;square feet;#meerkat]","[]","[]","[Iowa]","[]",11,17,235149,NA,13,"Santorum, Rick (R) Presidential Campaign","Republican","Male","True","Candidates > Presidential 2016","Graduate","Roman Catholic","White","1958-05-10","55-64","[Law]","","[Federal;State]"
"8692","53696075","Twitter","LIVE on #Periscope: Packing a order at Brownells #madeinamerica https://t.co/eWaNZOtDRY","2015-07-17 19:23:07Z","http://twitter.com/RickSantorum/status/622124389333495809","[order;#MadeInAmerica;#periscope]","[]","[]","[]","[]",5,15,235149,NA,10,"Santorum, Rick (R) Presidential Campaign","Republican","Male","True","Candidates > Presidential 2016","Graduate","Roman Catholic","White","1958-05-10","55-64","[Law]","","[Federal;State]"
"8699","53697605","Twitter","@marcorubio Where do I get campaign signs like this made? #iacaucus http://t.co/vyZGBRURey","2015-07-17 19:42:27Z","http://twitter.com/RickSantorum/status/622129253660753920","[campaign;signs;campaign signs;#iacaucus]","[]","[]","[]","[]",245,181,235148,NA,12,"Santorum, Rick (R) Presidential Campaign","Republican","Male","True","Candidates > Presidential 2016","Graduate","Roman Catholic","White","1958-05-10","55-64","[Law]","","[Federal;State]"
"8702","53698103","Twitter","|LIVE NOW| Meeting with the hardworking Americans of Brownells #meerkat http://t.co/NoLwQWH0lp","2015-07-17 19:52:57Z","http://twitter.com/RickSantorum/status/622131895288004608","[#meerkat]","[]","[]","[]","[]",11,12,235149,NA,11,"Santorum, Rick (R) Presidential Campaign","Republican","Male","True","Candidates > Presidential 2016","Graduate","Roman Catholic","White","1958-05-10","55-64","[Law]","","[Federal;State]"
"8708","53699503","Twitter","Pete Brownell gave us a tour of  @brownellsinc in Grinell, IA with State Rep. Dave Maxwell. http://t.co/FyHmsgvqsR","2015-07-17 20:23:02Z","http://twitter.com/RickSantorum/status/622139466594041856","[tour;ia]","[Dave Maxwell;Pete Brownell]","[]","[]","[]",15,21,235165,NA,17,"Santorum, Rick (R) Presidential Campaign","Republican","Male","True","Candidates > Presidential 2016","Graduate","Roman Catholic","White","1958-05-10","55-64","[Law]","","[Federal;State]"
"8719","53700341","Twitter","Town Hall @BrownellsInc #rick2016 http://t.co/IDBBO3n6nw","2015-07-17 20:40:48Z","http://twitter.com/RickSantorum/status/622143939768782848","[#Rick2016]","[]","[]","[]","[]",23,24,235166,NA,5,"Santorum, Rick (R) Presidential Campaign","Republican","Male","True","Candidates > Presidential 2016","Graduate","Roman Catholic","White","1958-05-10","55-64","[Law]","","[Federal;State]"
"8744","53703347","Twitter","Iran is one of the world’s chief sponsors of terror. Join me in urging Congress to reject this #IranDeal. #Rick2016 http://t.co/jgVUzXIOoT","2015-07-17 21:55:25Z","http://twitter.com/RickSantorum/status/622162714887069696","[terror;sponsors;chief sponsors;#IranDeal;sponsors of terror;#Rick2016]","[]","[]","[Iran]","[]",85,106,235166,NA,21,"Santorum, Rick (R) Presidential Campaign","Republican","Male","True","Candidates > Presidential 2016","Graduate","Roman Catholic","White","1958-05-10","55-64","[Law]","","[Federal;State]"
"8962","53723865","Twitter",".@SenJohnMcCain is an American hero, period.","2015-07-18 16:47:08Z","http://twitter.com/RickSantorum/status/622447523861393408","[period;hero;american hero]","[]","[]","[]","[]",221,216,235216,NA,6,"Santorum, Rick (R) Presidential Campaign","Republican","Male","True","Candidates > Presidential 2016","Graduate","Roman Catholic","White","1958-05-10","55-64","[Law]","","[Federal;State]"
"9013","53726711","Twitter","RT .@PDShinkman: .@RickSantorum shows up in the @usnews newsroom for a friendly game of peek-a-boo. http://t.co/WkywD0ML4h","2015-07-18 19:30:32Z","http://twitter.com/RickSantorum/status/622488643261870080","[newsroom;game;friendly game]","[]","[]","[]","[]",14,17,235270,NA,16,"Santorum, Rick (R) Presidential Campaign","Republican","Male","True","Candidates > Presidential 2016","Graduate","Roman Catholic","White","1958-05-10","55-64","[Law]","","[Federal;State]"
"9052","53730395","Twitter","LIVE on #Periscope: I'm about to go on stage with @frankluntz  https://t.co/6hRdhB4jAj","2015-07-18 22:42:20Z","http://twitter.com/RickSantorum/status/622536911454769152","[stage;#periscope]","[]","[]","[]","[]",20,25,235311,NA,12,"Santorum, Rick (R) Presidential Campaign","Republican","Male","True","Candidates > Presidential 2016","Graduate","Roman Catholic","White","1958-05-10","55-64","[Law]","","[Federal;State]"
"9208","53791361","Twitter","Excited about going back on the radio with my friend @DomShow1210 9:30 ET.","2015-07-20 13:24:58Z","http://twitter.com/RickSantorum/status/623121420508377089","[radio;friend]","[]","[]","[]","[]",8,12,235536,NA,13,"Santorum, Rick (R) Presidential Campaign","Republican","Male","True","Candidates > Presidential 2016","Graduate","Roman Catholic","White","1958-05-10","55-64","[Law]","","[Federal;State]"
"9214","53763633","Twitter","Next up I will be going on with .@kilmeade at 10:30 ET. Don't forget to watch for me with .@BretBaier tonight. #Rick2016","2015-07-20 13:54:25Z","http://twitter.com/RickSantorum/status/623128832745320448","[tonight;#Rick2016]","[]","[]","[]","[]",10,12,235498,NA,22,"Santorum, Rick (R) Presidential Campaign","Republican","Male","True","Candidates > Presidential 2016","Graduate","Roman Catholic","White","1958-05-10","55-64","[Law]","","[Federal;State]"
"9218","53764013","Twitter","Tune in to hear me have a good conversation with Brian on @kilmeade and Friends on Fox News Radio from 10:30-11am ET","2015-07-20 14:02:07Z","http://twitter.com/RickSantorum/status/623130769649758208","[conversation;tune]","[]","[]","[]","[]",15,14,235497,NA,22,"Santorum, Rick (R) Presidential Campaign","Republican","Male","True","Candidates > Presidential 2016","Graduate","Roman Catholic","White","1958-05-10","55-64","[Law]","","[Federal;State]"
"9237","53767317","Twitter","RT @patriotmom61: About Trump, Rick @RickSantorum on @DomShow1210 said he won't engage in making personal remarks about the others but ...","2015-07-20 15:00:33Z","http://twitter.com/RickSantorum/status/623145475584212992","[remarks;issues;personal remarks]","[]","[]","[]","[]",0,24,235496,NA,21,"Santorum, Rick (R) Presidential Campaign","Republican","Male","True","Candidates > Presidential 2016","Graduate","Roman Catholic","White","1958-05-10","55-64","[Law]","","[Federal;State]"
"9242","53768289","Twitter","Tune in to Special Report with Bret Baier tonight at 6pm ET on FOX News as I take the Center Seat http://t.co/23eq3qUdpn","2015-07-20 15:16:37Z","http://twitter.com/RickSantorum/status/623149520180744193","[fox;fox news;tune]","[Bret Baier]","[]","[]","[]",31,47,235498,NA,22,"Santorum, Rick (R) Presidential Campaign","Republican","Male","True","Candidates > Presidential 2016","Graduate","Roman Catholic","White","1958-05-10","55-64","[Law]","","[Federal;State]"
"9252","53770643","Twitter","At 1:20pm ET I'll be on John Gibson's show on Fox News Radio - looking forward to it! #FoxNewsRadio","2015-07-20 16:01:09Z","http://twitter.com/RickSantorum/status/623160725507342336","[]","[]","[]","[]","[]",11,23,235505,NA,19,"Santorum, Rick (R) Presidential Campaign","Republican","Male","True","Candidates > Presidential 2016","Graduate","Roman Catholic","White","1958-05-10","55-64","[Law]","","[Federal;State]"
"9279","53777883","Twitter","About to join .@MarkReardonKMOX at the bottom of the hour. #Rick2016","2015-07-20 18:20:24Z","http://twitter.com/RickSantorum/status/623195768057405440","[hour;bottom;#Rick2016]","[]","[]","[]","[]",9,14,235521,NA,11,"Santorum, Rick (R) Presidential Campaign","Republican","Male","True","Candidates > Presidential 2016","Graduate","Roman Catholic","White","1958-05-10","55-64","[Law]","","[Federal;State]"
"9287","53779389","Twitter","My interview w .@MarkReardonKMOX will run at 3:17 CT. Talking #IranDeal, #SCOTUSMarriage and the race","2015-07-20 18:53:22Z","http://twitter.com/RickSantorum/status/623204065925824512","[race;interview;#IranDeal;#SCOTUSmarriage;#SCOTUSMarriage]","[]","[]","[]","[]",16,32,235519,NA,15,"Santorum, Rick (R) Presidential Campaign","Republican","Male","True","Candidates > Presidential 2016","Graduate","Roman Catholic","White","1958-05-10","55-64","[Law]","","[Federal;State]"
"9384","53797731","Twitter","Did you miss my interview tonight with @BretBaier on @SpecialReport?  Check it out here! http://t.co/4izQywN7yq","2015-07-21 01:18:14Z","http://twitter.com/RickSantorum/status/623300919040569344","[tonight;interview;interview tonight]","[]","[]","[]","[]",42,82,235576,NA,15,"Santorum, Rick (R) Presidential Campaign","Republican","Male","True","Candidates > Presidential 2016","Graduate","Roman Catholic","White","1958-05-10","55-64","[Law]","","[Federal;State]"
"9389","53798071","Twitter","RT @FoxNews: .@RickSantorum: ""I have no doubt that Iran will be even more a fomenter of terrorism in the world."" #SpecialReport ...","2015-07-21 01:33:45Z","http://twitter.com/RickSantorum/status/623304825619521536","[doubt;#SpecialReport;fomenter]","[]","[]","[Iran]","[Terrorism]",0,177,235578,NA,22,"Santorum, Rick (R) Presidential Campaign","Republican","Male","True","Candidates > Presidential 2016","Graduate","Roman Catholic","White","1958-05-10","55-64","[Law]","","[Federal;State]"
"9390","53798073","Twitter","RT @FoxNews: .@RickSantorum: ""We have to start looking out for the interest of workers."" #SpecialReport http://t.co/OguYZ3DcYg","2015-07-21 01:33:51Z","http://twitter.com/RickSantorum/status/623304852580532224","[workers;interest;#SpecialReport;interest of workers]","[]","[]","[]","[]",0,118,235578,NA,16,"Santorum, Rick (R) Presidential Campaign","Republican","Male","True","Candidates > Presidential 2016","Graduate","Roman Catholic","White","1958-05-10","55-64","[Law]","","[Federal;State]"
"9414","53799319","Twitter","RT @seanhannity: .@AnnCoulter: ""The real litmus test for real conservatives is immigration."" #Hannity","2015-07-21 03:16:04Z","http://twitter.com/RickSantorum/status/623330574820884483","[litmus test;conservatives;litmus;#Hannity]","[]","[]","[]","[]",0,132,235586,NA,13,"Santorum, Rick (R) Presidential Campaign","Republican","Male","True","Candidates > Presidential 2016","Graduate","Roman Catholic","White","1958-05-10","55-64","[Law]","","[Federal;State]"
"9415","53799387","Twitter","RT @IngrahamAngle: YES @RickSantorum just KILLED IT re. the need to restrict legal & illegal immigration.  It's abt AMERICAN workers. ...","2015-07-21 03:21:44Z","http://twitter.com/RickSantorum/status/623332000074727424","[immigration;workers;illegal immigration]","[]","[]","[]","[Immigration Control]",0,157,235586,NA,21,"Santorum, Rick (R) Presidential Campaign","Republican","Male","True","Candidates > Presidential 2016","Graduate","Roman Catholic","White","1958-05-10","55-64","[Law]","","[Federal;State]"
"9417","53799523","Twitter","""@DocMomMN: Just made a donation to Rick Santorum for President https://t.co/2mcvxMouZ0""   Thank you!","2015-07-21 03:36:06Z","http://twitter.com/RickSantorum/status/623335616210698241","[donation]","[Rick Santorum]","[]","[]","[]",20,19,235583,NA,13,"Santorum, Rick (R) Presidential Campaign","Republican","Male","True","Candidates > Presidential 2016","Graduate","Roman Catholic","White","1958-05-10","55-64","[Law]","","[Federal;State]"
"9515","53817623","Twitter","Turn on @FoxNews at 4pm ET to watch @TeamCavuto and I discuss the issues of the day!","2015-07-21 15:45:32Z","http://twitter.com/RickSantorum/status/623519184320921600","[day;issues]","[]","[]","[]","[]",21,36,235618,NA,17,"Santorum, Rick (R) Presidential Campaign","Republican","Male","True","Candidates > Presidential 2016","Graduate","Roman Catholic","White","1958-05-10","55-64","[Law]","","[Federal;State]"
