"","releaseId","ContentType","Title","Date","Url","Keywords","Names","Organizations","Places","AssignedCategories","FavoritesLikes","RetweetsShares","FollowersCount","CommentsCount","WordCount","Source","Party","Gender","IsCurrent","SourceType","EducationLevel","Religion","Race","DateOfBirth","AgeRange","Industry","Military","PriorPublicOffice"
"26859","62979397","Twitter","Enjoyed joining @JennaLeeUSA on @FoxNews today to take questions from you, the viewers! https://t.co/rs47ONGZD2","2015-10-20 21:29:59Z","http://twitter.com/RickSantorum/status/656583162093547520","[questions;viewers]","[]","[]","[]","[]",28,43,245961,NA,14,"Santorum, Rick (R) Presidential Campaign","Republican","Male","True","Candidates > Presidential 2016","Graduate","Roman Catholic","White","1958-05-10","55-64","[Law]","","[Federal;State]"
"26881","62982965","Twitter","RT @jaketapper: Santorum: Obama W.H. partly responsible for violence in Israel https://t.co/MGVZtqDJtu - @RickSantorum on #TheLead","2015-10-20 23:18:45Z","http://twitter.com/RickSantorum/status/656610537065861121","[violence;#TheLead;responsible for violence]","[]","[]","[Israel]","[]",0,18,245967,NA,16,"Santorum, Rick (R) Presidential Campaign","Republican","Male","True","Candidates > Presidential 2016","Graduate","Roman Catholic","White","1958-05-10","55-64","[Law]","","[Federal;State]"
"26882","62982969","Twitter","RT @loudobbsnews: .@RickSantorum confident in his 2016 presidential run joins @loudobbsnews TONIGHT on #LouDobbsTonight 7PM EST","2015-10-20 23:18:51Z","http://twitter.com/RickSantorum/status/656610559157235717","[tonight;run;presidential run;#LouDobbsTonight]","[]","[]","[]","[]",0,9,245967,NA,16,"Santorum, Rick (R) Presidential Campaign","Republican","Male","True","Candidates > Presidential 2016","Graduate","Roman Catholic","White","1958-05-10","55-64","[Law]","","[Federal;State]"
"26883","62982977","Twitter","RT @CNN: .@RickSantorum on his political strategy: Being ""the guy you bring home to mom"" https://t.co/ZFphWHEect @jaketapper ...","2015-10-20 23:18:55Z","http://twitter.com/RickSantorum/status/656610577784160256","[guy;mom;political strategy]","[]","[]","[]","[]",0,34,245967,NA,18,"Santorum, Rick (R) Presidential Campaign","Republican","Male","True","Candidates > Presidential 2016","Graduate","Roman Catholic","White","1958-05-10","55-64","[Law]","","[Federal;State]"
"26884","62982981","Twitter","RT @CNNPolitics: .@RickSantorum: Voters will ""date around"" and eventually ""decide who they're going to marry"" https://t.co/6OZtrg079U ...","2015-10-20 23:19:05Z","http://twitter.com/RickSantorum/status/656610619429363712","[date;voters]","[]","[]","[]","[]",0,24,245967,NA,17,"Santorum, Rick (R) Presidential Campaign","Republican","Male","True","Candidates > Presidential 2016","Graduate","Roman Catholic","White","1958-05-10","55-64","[Law]","","[Federal;State]"
"26885","62983289","Twitter","RT @JennaLeeUSA: ICYMI: I asked @RickSantorum...what happened to the sweater vest? #4Questions https://t.co/vcC3PxDNC7","2015-10-20 23:28:22Z","http://twitter.com/RickSantorum/status/656612954775924736","[vest;sweater;sweater vest]","[]","[]","[]","[]",0,9,245965,NA,13,"Santorum, Rick (R) Presidential Campaign","Republican","Male","True","Candidates > Presidential 2016","Graduate","Roman Catholic","White","1958-05-10","55-64","[Law]","","[Federal;State]"
"26937","63006337","Twitter","Last night I joined @loudobbsnews on @FoxBusiness to talk about our plan to fight for American jobs! https://t.co/uVLsGfeEkc","2015-10-21 12:19:20Z","http://twitter.com/RickSantorum/status/656806975725019137","[jobs;night;last night;american jobs]","[]","[]","[]","[Jobs]",24,37,245991,NA,18,"Santorum, Rick (R) Presidential Campaign","Republican","Male","True","Candidates > Presidential 2016","Graduate","Roman Catholic","White","1958-05-10","55-64","[Law]","","[Federal;State]"
"26938","63006453","Twitter","RT @TheLeadCNN: Santorum: Obama W.H. partly responsible for violence in Israel https://t.co/aTZjzqT8hw - @RickSantorum on #TheLead","2015-10-21 12:23:46Z","http://twitter.com/RickSantorum/status/656808091539914752","[violence;#TheLead;responsible for violence]","[]","[]","[Israel]","[]",0,17,245990,NA,16,"Santorum, Rick (R) Presidential Campaign","Republican","Male","True","Candidates > Presidential 2016","Graduate","Roman Catholic","White","1958-05-10","55-64","[Law]","","[Federal;State]"
"26939","63006457","Twitter","RT @CNNPolitics: .@RickSantorum says @POTUS shares blame for problems in Israel https://t.co/6OZtrg079U https://t.co/nljAiUx3EO","2015-10-21 12:24:10Z","http://twitter.com/RickSantorum/status/656808189883785216","[problems;shares]","[]","[]","[Israel]","[]",0,19,245990,NA,13,"Santorum, Rick (R) Presidential Campaign","Republican","Male","True","Candidates > Presidential 2016","Graduate","Roman Catholic","White","1958-05-10","55-64","[Law]","","[Federal;State]"
"27030","63050987","Twitter","Last night I joined @loudobbsnews on @FoxBusiness to talk about our plan to fight for hardworking families https://t.co/uVLsGfeEkc","2015-10-21 19:27:36Z","http://twitter.com/RickSantorum/status/656914754271842306","[plan;night;last night]","[]","[]","[]","[]",27,38,246010,NA,18,"Santorum, Rick (R) Presidential Campaign","Republican","Male","True","Candidates > Presidential 2016","Graduate","Roman Catholic","White","1958-05-10","55-64","[Law]","","[Federal;State]"
"27060","63063695","Twitter","RT @glennbeck: .@RickSantorum joins me for the full hour — now on @theblaze.  Watch: https://t.co/Bn8v3oS7s7 https://t.co/gioGWgkM3t","2015-10-21 21:48:35Z","http://twitter.com/RickSantorum/status/656950233268658177","[hour;full hour]","[]","[]","[]","[]",0,16,246012,NA,16,"Santorum, Rick (R) Presidential Campaign","Republican","Male","True","Candidates > Presidential 2016","Graduate","Roman Catholic","White","1958-05-10","55-64","[Law]","","[Federal;State]"
"27244","63119065","Twitter","Everything Hillary Clinton says is tested by focus groups. Did you ever wonder how those focus groups look? https://t.co/msuUZ5F162","2015-10-22 19:47:02Z","http://twitter.com/RickSantorum/status/657282030250696705","[focus;groups;focus groups]","[Hillary Clinton]","[]","[]","[]",60,69,246087,NA,19,"Santorum, Rick (R) Presidential Campaign","Republican","Male","True","Candidates > Presidential 2016","Graduate","Roman Catholic","White","1958-05-10","55-64","[Law]","","[Federal;State]"
"27417","63193159","Twitter","I will be joining @GretchenCarlson today at 2:15pm ET on @FoxNews. We'll be talking #2016 and #Benghazi","2015-10-23 17:30:54Z","http://twitter.com/RickSantorum/status/657610160651812868","[today;#Benghazi;#2016]","[]","[]","[]","[]",33,32,246160,NA,17,"Santorum, Rick (R) Presidential Campaign","Republican","Male","True","Candidates > Presidential 2016","Graduate","Roman Catholic","White","1958-05-10","55-64","[Law]","","[Federal;State]"
"27763","63266479","Twitter","Grateful to be the guest of the Kansas City Chiefs today, but I've got to stay true to my roots! #HereWeGo https://t.co/47BgHCvBeI","2015-10-25 16:10:51Z","http://twitter.com/RickSantorum/status/658314787949051909","[roots;guest;#HereWeGo]","[]","[]","[Kansas City]","[]",60,41,246227,NA,22,"Santorum, Rick (R) Presidential Campaign","Republican","Male","True","Candidates > Presidential 2016","Graduate","Roman Catholic","White","1958-05-10","55-64","[Law]","","[Federal;State]"
"27777","63268817","Twitter","Have you picked up your Santorum for President bumper sticker?  Visit our online store and get one today! https://t.co/XDKpxfbpbY","2015-10-25 18:24:01Z","http://twitter.com/RickSantorum/status/658348302153420800","[sticker;bumper sticker;bumper;online store]","[]","[]","[]","[]",27,40,246228,NA,19,"Santorum, Rick (R) Presidential Campaign","Republican","Male","True","Candidates > Presidential 2016","Graduate","Roman Catholic","White","1958-05-10","55-64","[Law]","","[Federal;State]"
"27788","63269441","Twitter","RT @brianstelter: I enjoy ""going on some of the shows that don't agree with me; it gives me an opportunity to deal with some of the ...","2015-10-25 19:00:11Z","http://twitter.com/RickSantorum/status/658357404120297473","[criticism;shows]","[]","[]","[]","[]",0,36,246225,NA,27,"Santorum, Rick (R) Presidential Campaign","Republican","Male","True","Candidates > Presidential 2016","Graduate","Roman Catholic","White","1958-05-10","55-64","[Law]","","[Federal;State]"
"27811","63270473","Twitter","Our online campaign store is open for business. Pick up your Santorum for President t-shirt today! https://t.co/XDKpxfbpbY","2015-10-25 20:34:25Z","http://twitter.com/RickSantorum/status/658381117536522240","[campaign;store;online campaign;campaign store;online campaign store]","[]","[]","[]","[]",35,42,246228,NA,17,"Santorum, Rick (R) Presidential Campaign","Republican","Male","True","Candidates > Presidential 2016","Graduate","Roman Catholic","White","1958-05-10","55-64","[Law]","","[Federal;State]"
"27829","63276239","Twitter","Spotted this supporter in VA. Pick up your Santorum for President bumper sticker today! https://t.co/XDKpxfbpbY https://t.co/DqeWCLsvBv","2015-10-25 23:45:08Z","http://twitter.com/RickSantorum/status/658429116123906048","[sticker;bumper sticker;bumper;bumper sticker today;sticker today]","[]","[]","[]","[]",54,50,246224,NA,16,"Santorum, Rick (R) Presidential Campaign","Republican","Male","True","Candidates > Presidential 2016","Graduate","Roman Catholic","White","1958-05-10","55-64","[Law]","","[Federal;State]"
"28025","63361823","Twitter","Prepared for CNBC economy debate by playing Monopoly with @karensantorum @DanSantorum and son Peter.  I won - Hope I didn't peak too soon","2015-10-27 03:44:17Z","http://twitter.com/RickSantorum/status/658851686803484673","[son;debate;economy debate]","[]","[]","[]","[Anticompetitive Practices]",83,64,246273,NA,23,"Santorum, Rick (R) Presidential Campaign","Republican","Male","True","Candidates > Presidential 2016","Graduate","Roman Catholic","White","1958-05-10","55-64","[Law]","","[Federal;State]"
"28314","63504959","Twitter","Fueling up for the debate with great friends #CNBCGOPDebate #GOPDebate https://t.co/bBJhHxjocd","2015-10-28 19:18:03Z","http://twitter.com/RickSantorum/status/659449062408650753","[debate;#gopdebate;friends;great friends;#CNBCGOPDebate]","[]","[]","[]","[]",49,42,246376,NA,11,"Santorum, Rick (R) Presidential Campaign","Republican","Male","True","Candidates > Presidential 2016","Graduate","Roman Catholic","White","1958-05-10","55-64","[Law]","","[Federal;State]"
"28366","63513309","Twitter","No better way to spend a debate day than with Foster, one of the kindest friends I could ever ask for! #GOPDebate https://t.co/o8fsGu69lf","2015-10-28 21:30:02Z","http://twitter.com/RickSantorum/status/659482279329206272","[debate;debate day;#gopdebate;friends]","[]","[]","[]","[]",54,61,246378,NA,23,"Santorum, Rick (R) Presidential Campaign","Republican","Male","True","Candidates > Presidential 2016","Graduate","Roman Catholic","White","1958-05-10","55-64","[Law]","","[Federal;State]"
"28382","63514877","Twitter","Make sure to tune in! https://t.co/2iqgIXZprU","2015-10-28 22:01:08Z","http://twitter.com/RickSantorum/status/659490105808302080","[]","[]","[]","[]","[]",27,22,246384,NA,6,"Santorum, Rick (R) Presidential Campaign","Republican","Male","True","Candidates > Presidential 2016","Graduate","Roman Catholic","White","1958-05-10","55-64","[Law]","","[Federal;State]"
"28394","63515785","Twitter","We need a conservative that can deliver! #GOPDebate","2015-10-28 22:11:38Z","http://twitter.com/RickSantorum/status/659492747796193280","[#gopdebate]","[]","[]","[]","[]",38,40,246388,NA,8,"Santorum, Rick (R) Presidential Campaign","Republican","Male","True","Candidates > Presidential 2016","Graduate","Roman Catholic","White","1958-05-10","55-64","[Law]","","[Federal;State]"
"28410","63516049","Twitter","My flat tax provides a 20/20 clear vision for America that ends the corrupt #IRS #GOPDebate","2015-10-28 22:14:43Z","http://twitter.com/RickSantorum/status/659493522014384128","[tax;vision;flat tax;clear vision;#IRS;#gopdebate]","[]","[]","[America]","[Tax policies]",25,36,246389,NA,16,"Santorum, Rick (R) Presidential Campaign","Republican","Male","True","Candidates > Presidential 2016","Graduate","Roman Catholic","White","1958-05-10","55-64","[Law]","","[Federal;State]"
"28416","63516149","Twitter","In my first 100 days as president, I will submit to Congress a comprehensive Economic Freedom Agenda that will abolish tax code. #GOPDebate","2015-10-28 22:15:39Z","http://twitter.com/RickSantorum/status/659493759676194820","[tax;code;tax code;#gopdebate]","[]","[]","[]","[Taxation]",33,38,246389,NA,23,"Santorum, Rick (R) Presidential Campaign","Republican","Male","True","Candidates > Presidential 2016","Graduate","Roman Catholic","White","1958-05-10","55-64","[Law]","","[Federal;State]"
"28418","63516175","Twitter","Under my fair, flat tax plan, Warren Buffett will no longer pay less than his secretary.  #GOPDebate","2015-10-28 22:15:53Z","http://twitter.com/RickSantorum/status/659493818388058112","[tax;plan;tax plan;flat tax;flat tax plan;#gopdebate]","[Warren Buffett]","[]","[]","[Tax policies]",40,53,246389,NA,17,"Santorum, Rick (R) Presidential Campaign","Republican","Male","True","Candidates > Presidential 2016","Graduate","Roman Catholic","White","1958-05-10","55-64","[Law]","","[Federal;State]"
"28421","63516203","Twitter","My flat tax plan will explode the corrupt #IRS code #GOPDebate","2015-10-28 22:16:06Z","http://twitter.com/RickSantorum/status/659493872943374336","[tax;code;tax plan;flat tax;flat tax plan;#IRS;#gopdebate]","[]","[]","[]","[Tax policies]",41,40,246389,NA,11,"Santorum, Rick (R) Presidential Campaign","Republican","Male","True","Candidates > Presidential 2016","Graduate","Roman Catholic","White","1958-05-10","55-64","[Law]","","[Federal;State]"
"28430","63516373","Twitter","RT @TeamSantorumWV: American #manufacturers will grow & thrive under a @RickSantorum administration. #Rick2016 #CNBCgopdebate ...","2015-10-28 22:17:48Z","http://twitter.com/RickSantorum/status/659494299890024448","[administration;#manufacturing;#manufacturers;#Rick2016;#CNBCGOPDebate]","[]","[]","[]","[]",0,11,246388,NA,15,"Santorum, Rick (R) Presidential Campaign","Republican","Male","True","Candidates > Presidential 2016","Graduate","Roman Catholic","White","1958-05-10","55-64","[Law]","","[Federal;State]"
"28433","63516449","Twitter","RT @patrinapmosley: ""The biggest problem for the American worker is the breakdown of the American family. ""-@RickSantorum @PYNance @CWforA","2015-10-28 22:18:30Z","http://twitter.com/RickSantorum/status/659494475522310144","[worker;breakdown;biggest problem;american worker]","[]","[]","[]","[]",0,20,246389,NA,19,"Santorum, Rick (R) Presidential Campaign","Republican","Male","True","Candidates > Presidential 2016","Graduate","Roman Catholic","White","1958-05-10","55-64","[Law]","","[Federal;State]"
"28441","63516559","Twitter","RT @DocMomMN: One candidate is talking about the American worker and our everyday real concerns #CNBCGOPDebate @RickSantorum #Rick2016","2015-10-28 22:19:34Z","http://twitter.com/RickSantorum/status/659494745622859776","[worker;candidate;real concerns;american worker;#Rick2016;#CNBCGOPDebate]","[]","[]","[]","[]",0,13,246389,NA,18,"Santorum, Rick (R) Presidential Campaign","Republican","Male","True","Candidates > Presidential 2016","Graduate","Roman Catholic","White","1958-05-10","55-64","[Law]","","[Federal;State]"
"28465","63516903","Twitter","My Economic Freedom Agenda will create over 3 million new jobs above current projections #GOPDebate","2015-10-28 22:26:05Z","http://twitter.com/RickSantorum/status/659496384308097024","[jobs;projections;current projections;#gopdebate]","[]","[]","[]","[Jobs]",25,44,246388,NA,15,"Santorum, Rick (R) Presidential Campaign","Republican","Male","True","Candidates > Presidential 2016","Graduate","Roman Catholic","White","1958-05-10","55-64","[Law]","","[Federal;State]"
"28468","63516925","Twitter","We need a plan to revitalize American manufacturing to get America back to work #GOPDebate","2015-10-28 22:26:42Z","http://twitter.com/RickSantorum/status/659496539518312448","[plan;manufacturing;#gopdebate;american manufacturing]","[]","[]","[America]","[]",35,46,246388,NA,15,"Santorum, Rick (R) Presidential Campaign","Republican","Male","True","Candidates > Presidential 2016","Graduate","Roman Catholic","White","1958-05-10","55-64","[Law]","","[Federal;State]"
"28489","63517217","Twitter","We must rebuild the economy, the family, and ensure we have a responsible immigration policy that puts the American worker first #GOPDebate","2015-10-28 22:33:37Z","http://twitter.com/RickSantorum/status/659498279286239232","[immigration;worker;immigration policy;responsible immigration;#gopdebate;responsible immigration policy]","[]","[]","[]","[Immigration Policies]",52,72,246389,NA,22,"Santorum, Rick (R) Presidential Campaign","Republican","Male","True","Candidates > Presidential 2016","Graduate","Roman Catholic","White","1958-05-10","55-64","[Law]","","[Federal;State]"
"28494","63517357","Twitter","Over the past 20 years, 35 million legal & illegal immigrants have come to U.S.  The largest mass immigration in American history #GOPDebate","2015-10-28 22:36:04Z","http://twitter.com/RickSantorum/status/659498897946099713","[immigration;immigrants;illegal immigrants;mass immigration;#gopdebate]","[]","[]","[]","[]",33,55,246392,NA,23,"Santorum, Rick (R) Presidential Campaign","Republican","Male","True","Candidates > Presidential 2016","Graduate","Roman Catholic","White","1958-05-10","55-64","[Law]","","[Federal;State]"
"28496","63517437","Twitter","We must reduce legal immigration by 25% by ending chain migration and the visa lottery #GOPDebate","2015-10-28 22:36:40Z","http://twitter.com/RickSantorum/status/659499047670177794","[migration;lottery;visa lottery;chain migration;#gopdebate]","[]","[]","[]","[]",36,52,246392,NA,16,"Santorum, Rick (R) Presidential Campaign","Republican","Male","True","Candidates > Presidential 2016","Graduate","Roman Catholic","White","1958-05-10","55-64","[Law]","","[Federal;State]"
"28497","63517503","Twitter","My immigration plan is common-sense because stagnant wages & joblessness is not good for anyone #GOPDebate","2015-10-28 22:37:22Z","http://twitter.com/RickSantorum/status/659499223373754374","[wages;immigration plan;stagnant wages;#gopdebate;joblessness]","[]","[]","[]","[Unemployment]",30,46,246392,NA,16,"Santorum, Rick (R) Presidential Campaign","Republican","Male","True","Candidates > Presidential 2016","Graduate","Roman Catholic","White","1958-05-10","55-64","[Law]","","[Federal;State]"
"28501","63517575","Twitter","Immigration can be a very good thing.  But there can also be too much of a good thing #GOPDebate","2015-10-28 22:38:12Z","http://twitter.com/RickSantorum/status/659499432854048769","[#gopdebate]","[]","[]","[]","[]",27,40,246392,NA,19,"Santorum, Rick (R) Presidential Campaign","Republican","Male","True","Candidates > Presidential 2016","Graduate","Roman Catholic","White","1958-05-10","55-64","[Law]","","[Federal;State]"
"28503","63517629","Twitter","America is worth the wait and it is worth doing it right.  We need an immigration policy that rewards those who do it right #GOPDebate","2015-10-28 22:38:43Z","http://twitter.com/RickSantorum/status/659499561833091076","[immigration;immigration policy;wait;#gopdebate]","[]","[]","[America]","[Immigration Policies]",42,61,246390,NA,25,"Santorum, Rick (R) Presidential Campaign","Republican","Male","True","Candidates > Presidential 2016","Graduate","Roman Catholic","White","1958-05-10","55-64","[Law]","","[Federal;State]"
"28509","63517749","Twitter","We must secure our border and implement e-verify so the job market for illegal immigrants is closed #GOPDebate","2015-10-28 22:39:57Z","http://twitter.com/RickSantorum/status/659499871829929984","[border;immigrants;illegal immigrants;job market;#gopdebate]","[]","[]","[]","[Jobs]",50,64,246390,NA,18,"Santorum, Rick (R) Presidential Campaign","Republican","Male","True","Candidates > Presidential 2016","Graduate","Roman Catholic","White","1958-05-10","55-64","[Law]","","[Federal;State]"
"28511","63517779","Twitter","The liberal Left wants to provide amnesty & increase the influx of immigrant workers because they want to increase their power  #GOPDebate","2015-10-28 22:40:18Z","http://twitter.com/RickSantorum/status/659499962254929921","[amnesty;immigrant workers;influx;#gopdebate]","[]","[]","[]","[]",49,76,246389,NA,22,"Santorum, Rick (R) Presidential Campaign","Republican","Male","True","Candidates > Presidential 2016","Graduate","Roman Catholic","White","1958-05-10","55-64","[Law]","","[Federal;State]"
"28514","63517827","Twitter","The business wing of the GOP sees immigrant workers as a way of diluting the labor market and lowering labor costs.  #GOPDebate","2015-10-28 22:40:46Z","http://twitter.com/RickSantorum/status/659500078009290752","[wing;labor;labor costs;labor market;#gopdebate]","[]","[]","[]","[Labor Supply]",37,68,246389,NA,22,"Santorum, Rick (R) Presidential Campaign","Republican","Male","True","Candidates > Presidential 2016","Graduate","Roman Catholic","White","1958-05-10","55-64","[Law]","","[Federal;State]"
"28521","63518413","Twitter","Labor supply and demand works, corporate profits are up & execs are doing well.  But the American worker suffers #GOPDebate","2015-10-28 22:46:52Z","http://twitter.com/RickSantorum/status/659501612877144064","[demand;profits;corporate profits;#gopdebate]","[]","[]","[]","[Labor Supply]",18,49,246391,NA,20,"Santorum, Rick (R) Presidential Campaign","Republican","Male","True","Candidates > Presidential 2016","Graduate","Roman Catholic","White","1958-05-10","55-64","[Law]","","[Federal;State]"
"28524","63518515","Twitter","America works best when Americans are working.  My plan will put America back to work #GOPDebate","2015-10-28 22:47:47Z","http://twitter.com/RickSantorum/status/659501846109753344","[plan;#gopdebate;americans]","[]","[]","[America]","[]",34,45,246390,NA,16,"Santorum, Rick (R) Presidential Campaign","Republican","Male","True","Candidates > Presidential 2016","Graduate","Roman Catholic","White","1958-05-10","55-64","[Law]","","[Federal;State]"
"28543","63519211","Twitter","The American family is the first economy #GOPDebate","2015-10-28 22:57:20Z","http://twitter.com/RickSantorum/status/659504246497394688","[family;economy;#gopdebate;american family]","[]","[]","[]","[]",47,58,246399,NA,8,"Santorum, Rick (R) Presidential Campaign","Republican","Male","True","Candidates > Presidential 2016","Graduate","Roman Catholic","White","1958-05-10","55-64","[Law]","","[Federal;State]"
"28546","63519241","Twitter","My tax plan is the only GOP plan that does not blow a hole in the federal budget #GOPDebate","2015-10-28 22:58:13Z","http://twitter.com/RickSantorum/status/659504471442104320","[plan;federal budget;hole;tax plan;#gopdebate]","[]","[]","[]","[Government Budgets]",35,50,246399,NA,19,"Santorum, Rick (R) Presidential Campaign","Republican","Male","True","Candidates > Presidential 2016","Graduate","Roman Catholic","White","1958-05-10","55-64","[Law]","","[Federal;State]"
"28592","63520089","Twitter","I offer Americans a clear conservative vision, serious plans for reform, and the experience to get the job done #GOPDebate","2015-10-28 23:22:37Z","http://twitter.com/RickSantorum/status/659510611630510080","[vision;reform;conservative vision;clear conservative vision;#gopdebate;serious plans]","[]","[]","[]","[Jobs]",48,59,246420,NA,20,"Santorum, Rick (R) Presidential Campaign","Republican","Male","True","Candidates > Presidential 2016","Graduate","Roman Catholic","White","1958-05-10","55-64","[Law]","","[Federal;State]"
"28603","63520393","Twitter","We need a tax policy, immigration policy, regulatory policy that puts the American worker first #GOPDebate","2015-10-28 23:33:02Z","http://twitter.com/RickSantorum/status/659513234622455809","[policy;immigration;regulatory policy;immigration policy;#gopdebate]","[]","[]","[]","[Immigration Policies;Tax policies]",42,44,246426,NA,16,"Santorum, Rick (R) Presidential Campaign","Republican","Male","True","Candidates > Presidential 2016","Graduate","Roman Catholic","White","1958-05-10","55-64","[Law]","","[Federal;State]"
"28612","63520757","Twitter","My Economic Freedom Agenda will end the corrupt #IRS, repeal Obama’s regulations, and unleash American energy potential #GOPDebate","2015-10-28 23:47:15Z","http://twitter.com/RickSantorum/status/659516812053372928","[regulations;repeal;#IRS;#gopdebate;american energy]","[]","[]","[]","[Energy]",38,62,246434,NA,18,"Santorum, Rick (R) Presidential Campaign","Republican","Male","True","Candidates > Presidential 2016","Graduate","Roman Catholic","White","1958-05-10","55-64","[Law]","","[Federal;State]"
"29005","63543397","Twitter","RT @AR_Future: .@RickSantorum visiting SIRE ethanol plant in Council Bluffs. His 3rd Iowa biofuels plant stop this year #iacaucus ...","2015-10-29 15:51:03Z","http://twitter.com/RickSantorum/status/659759358864003072","[plant;sire;ethanol plant;biofuels plant;#iacaucus]","[]","[]","[Iowa;Council Bluffs]","[Biofuels]",0,10,246526,NA,20,"Santorum, Rick (R) Presidential Campaign","Republican","Male","True","Candidates > Presidential 2016","Graduate","Roman Catholic","White","1958-05-10","55-64","[Law]","","[Federal;State]"
"29006","63543425","Twitter","RT @Bencjacobs: INBOX: RICK SANTORUM EXPANDS, JEB BUSH CAMPAIGN SCALES BACK","2015-10-29 15:51:17Z","http://twitter.com/RickSantorum/status/659759417169022976","[]","[]","[]","[]","[]",0,6,246526,NA,11,"Santorum, Rick (R) Presidential Campaign","Republican","Male","True","Candidates > Presidential 2016","Graduate","Roman Catholic","White","1958-05-10","55-64","[Law]","","[Federal;State]"
